[{"category":"Barber shop","date_found":"2026-10-05","evidence":"Facebook page only, no standalone website (sample entry — replace with real leads)","id":"lead-001","last_contact":null,"name":"Sample Barber Shop","neighborhood":"Sample Neighbourhood","notes":"","score":5,"status":"new","website":null,"website_status":"none"},{"category":"Pho restaurant","date_found":"2026-10-05","evidence":"Text-only menu page, no images or online ordering (sample entry — replace with real leads)","id":"lead-002","last_contact":null,"name":"Sample Pho Restaurant","neighborhood":"Sample Neighbourhood","notes":"Flyer + concept site drafted.","score":4,"status":"researched","website":"http://example.com/","website_status":"outdated"}]